{
  "$schema": "https://bonsaibauer.github.io/shroudforge/schemas/extended.mod.schema.json",
  "schemaVersion": 1,
  "enabled": true,
  "links": {
    "source-github": "https://github.com/bonsaibauer/shroudforge",
    "issues": "https://github.com/bonsaibauer/shroudforge/issues/new?template=bug_report.yml",
    "support-bmac": "https://buymeacoffee.com/bonsaibauer"
  },
  "changelog": [
    "Documents global patch scope and reports activation and restoration failures consistently."
  ]
}
